"id","blog_content_id","no","name","content","detail","blog_category_id","user_id","status","posts_date","content_draft","detail_draft","publish_begin","publish_end","exclude_search","eye_catch","created","modified"
"","1","1","ホームページをオープンしました","本文が入ります。本文が入ります。本文が入ります。本文が入ります。本文が入ります。本文が入ります。本文が入ります。本文が入ります。本文が入ります。<br /><br />本文が入ります。本文が入ります。本文が入ります。本文が入ります。本文が入ります。本文が入ります。本文が入ります。本文が入ります。本文が入ります。<br /><br />","詳細が入ります。詳細が入ります。詳細が入ります。詳細が入ります。詳細が入ります。詳細が入ります。詳細が入ります。詳細が入ります。詳細が入ります。<br /><br />詳細が入ります。詳細が入ります。詳細が入ります。詳細が入ります。詳細が入ります。詳細が入ります。詳細が入ります。詳細が入ります。詳細が入ります。
","1","1","1","2015-11-19 00:00:00","","","","","","","",""
"","1","2","新商品を販売を開始しました。","新商品を販売を開始しました。新商品を販売を開始しました。新商品を販売を開始しました。新商品を販売を開始しました。<br /><br />新商品を販売を開始しました。新商品を販売を開始しました。新商品を販売を開始しました。新商品を販売を開始しました。<br />","詳細が入ります。詳細が入ります。詳細が入ります。詳細が入ります。詳細が入ります。詳細が入ります。詳細が入ります。<br /><br />詳細が入ります。詳細が入ります。詳細が入ります。詳細が入ります。詳細が入ります。詳細が入ります。詳細が入ります。<br /><br />
詳細が入ります。詳細が入ります。詳細が入ります。詳細が入ります。詳細が入ります。詳細が入ります。詳細が入ります。<br />
<br />","1","1","1","2015-11-19 00:00:00","","","","","","","",""